{"id":"W4315589376","title":"Living-with and Designing-with Plants","authors":["Oscar Tomico","Ron Wakkary","Kristina Andersen"],"venue":"interactions","year":2023,"doi":"10.1145/3571589","url":"https://doi.org/10.1145/3571589","openalex":"https://openalex.org/W4315589376","abstract":"research-article Open Access Share on Living-with and Designing-with Plants Authors: Oscar Tomico Elisava and Eindhoven University of Technology Elisava and Eindhoven University of TechnologyView Profile , Ron Wakkary Simon Fraser University Simon Fraser UniversityView Profile , Kristina Andersen Eindhoven University of Technology Eindhoven University of TechnologyView Profile Authors Info & Claims InteractionsVolume 30Issue 1January - February 2023pp 30â€“34https://doi.org/10.1145/3571589Published:11 January 2023Publication History 3citation936DownloadsMetricsTotal Citations3Total Downloads936Last 12 Months936Last 6 weeks97 Get Citation AlertsNew Citation Alert added!This alert has been successfully added and will be sent to:You will be notified whenever a record that you have chosen has been cited.To manage your alert preferences, click on the button below.Manage my AlertsNew Citation Alert!Please log in to your account Save to BinderSave to BinderCreate a New BinderNameCancelCreateExport CitationPublisher SiteView all FormatsPDF","is_oa":true,"oa_status":null,"network":{"internal_citations":14,"cited_by_count":28},"references":10,"networkCitations":14,"seed":false}