{"id":"W4317863133","title":"IWBDA 2021: An Ongoing Journey to Shape the Future of Synthetic Biology Using Bio-Design Automation","authors":["Prashant Vaidyanathan"],"venue":"ACS Synthetic Biology","year":2023,"doi":"10.1021/acssynbio.2c00686","url":"https://doi.org/10.1021/acssynbio.2c00686","openalex":"https://openalex.org/W4317863133","abstract":"ADVERTISEMENT RETURN TO ISSUEEditorialNEXTIWBDA 2021: An Ongoing Journey to Shape the Future of Synthetic Biology Using Bio-Design AutomationPrashant Vaidyanathan*Prashant VaidyanathanOxford Biomedica, Oxford OX4 6LT, U.K.*Email: [email protected]More by Prashant VaidyanathanCite this: ACS Synth. Biol. 2023, 12, 2, 348–349Publication Date (Web):January 24, 2023Publication History Published online24 January 2023Published inissue 17 February 2023https://pubs.acs.org/doi/10.1021/acssynbio.2c00686https://doi.org/10.1021/acssynbio.2c00686editorialACS PublicationsCopyright © Published 2023 by American Chemical Society. This publication is available under these Terms of Use. Request reuse permissions This publication is free to access through this site. Learn MoreArticle Views910Altmetric-Citations-LEARN ABOUT THESE METRICSArticle Views are the COUNTER-compliant sum of full text article downloads since November 2008 (both PDF and HTML) across all institutions and individuals. These metrics are regularly updated to reflect usage leading up to the last few days.Citations are the number of other articles citing this article, calculated by Crossref and updated daily. Find more information about Crossref citation counts.The Altmetric Attention Score is a quantitative measure of the attention that a research article has received online. Clicking on the donut icon will load a page at altmetric.com with additional details about the score and the social media presence for the given article. Find more information on the Altmetric Attention Score and how the score is calculated. Share Add toView InAdd Full Text with ReferenceAdd Description ExportRISCitationCitation and abstractCitation and referencesMore Options Share onFacebookTwitterWechatLinked InRedditEmail PDF (898 KB) Get e-AlertscloseSUBJECTS:Bioengineering and biotechnology,Circuits,Genetics,Software,Synthetic biology Get e-Alerts","is_oa":true,"oa_status":null,"network":{"internal_citations":2,"cited_by_count":0},"references":14,"networkCitations":2,"seed":false}